identifier,title,description,issued,modified,landingPage,webService,spatial
http://opendata.dc.gov/datasets/c5ee1de0691b4ed198ee9525cbd6e800_0,Website Analytics for All Pages in 2016,This dataset is a direct export from DC government's Google Analytics report for all pages on the?http://www.dc.gov?web portal. This shows the top most visited pages on DC.gov. It is identified by the part of the URL after the dc.gov domain path where users have visited.More information at?http://support.google.com,2017-10-19T20:16:42.000Z,2017-11-01T16:06:05.021Z,http://opendata.dc.gov/datasets/c5ee1de0691b4ed198ee9525cbd6e800_0,http://opendata.arcgis.com/datasets/c5ee1de0691b4ed198ee9525cbd6e800_0/FeatureServer/0,"-77.136,38.786,-76.928,38.994",http://opendata.dc.gov/datasets/c5ee1de0691b4ed198ee9525cbd6e800_0
http://opendata.dc.gov/datasets/da5efb5502c54cd88a7c214fa1b0192d_8,Summer Meals Sites,"DC's youth 18 and under can receive reimbursement for free nutritious meals and snacks as part of the DC Free Summer Meals Program (FSMP). The program operates June through August, with meal times and dates varying by location.For further details on summer meal sites please visit the?DC Office of the State Superintendent of Education.",2016-03-22T13:37:16.000Z,2017-11-01T16:11:28.247Z,http://opendata.dc.gov/datasets/da5efb5502c54cd88a7c214fa1b0192d_8,https://maps2.dcgis.dc.gov/dcgis/rest/services/DCGIS_APPS/Summer_Events/MapServer/8,"-77.0807,38.8189,-76.9122,38.9819",http://opendata.dc.gov/datasets/da5efb5502c54cd88a7c214fa1b0192d_8
http://opendata.dc.gov/datasets/f77a23678bf0414d9c4a0d41eb70764e_0,Website Analytics for Content Drilldown in 2016,"This dataset is a direct export from DC government's Google Analytics report for content drilldown on the?http://www.dc.gov?web portal. The content drilldown shows activity at the folder level or sections of the DC.gov website. In many cases, this can be considered as the agency level. However, the DC.gov website is more than just agency sites so there will be cases of other sections shown here.More information at?http://support.google.com.",2017-10-19T20:46:43.000Z,2017-11-01T16:06:04.771Z,http://opendata.dc.gov/datasets/f77a23678bf0414d9c4a0d41eb70764e_0,http://opendata.arcgis.com/datasets/f77a23678bf0414d9c4a0d41eb70764e_0/FeatureServer/0,"-77.136,38.786,-76.928,38.994",http://opendata.dc.gov/datasets/f77a23678bf0414d9c4a0d41eb70764e_0
http://opendata.dc.gov/datasets/9ad16c12e50e4664a95a016766b5ad51_1,All Summer Events,"Summer events that have occurred, or will be occurring, sponsored by the District's Summer Strong DC. For more information visit?http://summer.dc.gov.",2017-06-07T16:35:38.000Z,2017-08-09T15:26:02.000Z,http://opendata.dc.gov/datasets/9ad16c12e50e4664a95a016766b5ad51_1,https://maps2.dcgis.dc.gov/dcgis/rest/services/DCGIS_APPS/Summer_Events/MapServer/1,"-77.0807,38.8189,-76.9198,38.9703",http://opendata.dc.gov/datasets/9ad16c12e50e4664a95a016766b5ad51_1
http://opendata.dc.gov/datasets/d9d0410e00a6424ab7ee6479023bebd4_0,2013 Private Building Energy and Water Performance Benchmarking (Retired),"This layer was retired on October 18, 2017.The Clean and Affordable Energy Act of 2008 established that all private buildings over 50,000 gross square feet within the District of Columbia (DC), including multifamily residences, must annually measure and disclose their energy and water consumption to the District Department of the Environment (DDOE). Benchmarking is defined as tracking a building?s energy and water use and using a standard metric to compare the building?s performance against past performance and to its peers nationwide. These comparisons have been shown to drive energy efficiency upgrades and increase occupancy rates and property values. DC has chosen U.S. EPA?s free, industry-standard ENERGY STAR? Portfolio Manager? tool for benchmarking and reporting. DDOE is required to publicly disclose the ENERGY STAR? Benchmarking results for each privately owned building that is subject to the benchmarking law, beginning with the 2nd year of benchmarking data for that building. For more information, see ddoe.dc.gov/energybenchmarking.",2015-01-29T19:52:00.000Z,2017-10-18T18:39:28.000Z,http://opendata.dc.gov/datasets/d9d0410e00a6424ab7ee6479023bebd4_0,http://opendata.arcgis.com/datasets/d9d0410e00a6424ab7ee6479023bebd4_0/FeatureServer/0,"-77.176,38.755,-76.896,39.035",http://opendata.dc.gov/datasets/d9d0410e00a6424ab7ee6479023bebd4_0
http://opendata.dc.gov/datasets/f2ffaaace4a645818a7e9de283e52af8_0,2014 Building Energy and Water Performance Benchmarking (Retired),"This layer was retired on October 18, 2017.The Clean and Affordable Energy Act of 2008 established that all private buildings over 50,000 gross square feet within the District of Columbia, including multifamily residences, must annually measure and disclose their energy and water consumption to the Department of Energy and Environment (DOEE). Benchmarking is defined as tracking a building?s energy and water use and using a standard metric to compare the building?s performance against past performance and to its peers nationwide. These comparisons have been shown to drive energy efficiency upgrades and increase occupancy rates and property values. The District of Columbia has chosen U.S. EPA?s free, industry-standard ENERGY STAR? Portfolio Manager? tool for benchmarking and reporting. DDOE is required to publicly disclose the ENERGY STAR? Benchmarking results for each publicly or privately owned building that is subject to the benchmarking law, beginning with the 2nd year of benchmarking data for that building. For more information, see?http://doee.dc.gov/energybenchmarking",2016-03-29T19:27:10.000Z,2017-10-18T18:38:12.000Z,http://opendata.dc.gov/datasets/f2ffaaace4a645818a7e9de283e52af8_0,http://opendata.arcgis.com/datasets/f2ffaaace4a645818a7e9de283e52af8_0/FeatureServer/0,"-77.176,38.755,-76.896,39.035",http://opendata.dc.gov/datasets/f2ffaaace4a645818a7e9de283e52af8_0
http://opendata.dc.gov/datasets/e8b6fca126474060a9209b0c94760572_0,Summer Events in Next 7 Days,Summer events that are scheduled to occur in the next 7 days where youth can participate. For more information visit?http://summer.dc.gov.,2017-06-07T16:31:28.000Z,2017-08-09T15:28:04.000Z,http://opendata.dc.gov/datasets/e8b6fca126474060a9209b0c94760572_0,https://maps2.dcgis.dc.gov/dcgis/rest/services/DCGIS_APPS/Summer_Events/MapServer/0,"-77.0807,38.8189,-76.9198,38.9703",http://opendata.dc.gov/datasets/e8b6fca126474060a9209b0c94760572_0
http://opendata.dc.gov/datasets/49319e1049304b8e9ab3bede4fc7b083_0,Website Analytics for Landing Pages in 2016,"This dataset is a direct export from DC government's Google Analytics report for landing pages on the?http://www.dc.gov?web portal.?The landing page is the first page viewed during a session, or in other words, the entrance page to the portal. Landing pages can be considered the most popular points of entry as users navigate the DC.gov website.More information at?http://support.google.com.",2017-10-19T20:04:25.000Z,2017-11-01T16:06:05.323Z,http://opendata.dc.gov/datasets/49319e1049304b8e9ab3bede4fc7b083_0,http://opendata.arcgis.com/datasets/49319e1049304b8e9ab3bede4fc7b083_0/FeatureServer/0,"-77.136,38.786,-76.928,38.994",http://opendata.dc.gov/datasets/49319e1049304b8e9ab3bede4fc7b083_0
http://opendata.dc.gov/datasets/14c3e977a76a4b46af6719b3d1a47694_7,Summer Crime Initiative Areas,Area boundaries for the MPD Summer Crime Initiative. The DC?Metropolitan Police Department (MPD)?and other partner agencies have identified these areas for improvement in social and public safety resources.,2015-12-01T16:09:38.000Z,2017-11-01T16:24:08.806Z,http://opendata.dc.gov/datasets/14c3e977a76a4b46af6719b3d1a47694_7,https://maps2.dcgis.dc.gov/dcgis/rest/services/DCGIS_APPS/Summer_Events/MapServer/7,"-76.9838,38.849,-76.9132,38.9124",http://opendata.dc.gov/datasets/14c3e977a76a4b46af6719b3d1a47694_7
