publisher,keyword,identifier,title,description,issued,modified,landingPage,webService,spatial
State of Michigan,"[u'Mi', u'DOT', u'Transportation', u'Michigan', u'5', u'Five', u'Year Plan']",http://gis-michigan.opendata.arcgis.com/datasets/7b041cb6663444d28cb69c422c86c9c1_44,Five Year Plan Bridges,"The Five-Year Transportation Program (5YTP) is an annual document listing road and bridge projects planned for the next five years. ?A snapshot of 5YTP projects is produced annually and presented for approval to the State Transportation Commission. ?The 5YTP snapshot is later archived and the document is posted on MDOT?s Web site. ?A Web-based interactive state map is available which plots individual projects for the public to easily view. Please see the?MDOT Metadata Form?for additional information or visit the?5YTP Website.?Update Cycle:?The Five Year Transportation Program (5YTP) layer is updated on an annual basis.Data Quality:?The GIS layer is generated from MDOT?s MAP database 5YTP archive snapshot.Coverage:?This layer covers all projects in the current 5YTP snapshot.Contact:?Lina Chapman,?ChapmanL@michigan.gov",2018-10-05T19:26:29.000Z,2018-10-23T15:58:55.507Z,http://gis-michigan.opendata.arcgis.com/datasets/7b041cb6663444d28cb69c422c86c9c1_44,https://gisago-qa.mcgi.state.mi.us/arcgis/rest/services/MDOT/MdotFiveYearPlanOpenData/FeatureServer/44,"-90.4772,41.6606,-82.097,47.2172",http://gis-michigan.opendata.arcgis.com/datasets/7b041cb6663444d28cb69c422c86c9c1_44
State of Michigan,"[u'Mi', u'DOT', u'Transportation', u'Michigan', u'5', u'Five', u'Year Plan']",http://gis-michigan.opendata.arcgis.com/datasets/7b041cb6663444d28cb69c422c86c9c1_45,Five Year Plan Roads,"The Five-Year Transportation Program (5YTP) is an annual document listing road and bridge projects planned for the next five years. ?A snapshot of 5YTP projects is produced annually and presented for approval to the State Transportation Commission. ?The 5YTP snapshot is later archived and the document is posted on MDOT?s Web site. ?A Web-based interactive state map is available which plots individual projects for the public to easily view. Please see the?MDOT Metadata Form?for additional information or visit the?5YTP Website.?Update Cycle:?The Five Year Transportation Program (5YTP) layer is updated on an annual basis.Data Quality:?The GIS layer is generated from MDOT?s MAP database 5YTP archive snapshot.Coverage:?This layer covers all projects in the current 5YTP snapshot.Contact:?Lina Chapman,?ChapmanL@michigan.gov",2018-10-05T19:26:29.000Z,2018-10-05T19:48:21.754Z,http://gis-michigan.opendata.arcgis.com/datasets/7b041cb6663444d28cb69c422c86c9c1_45,https://gisago-qa.mcgi.state.mi.us/arcgis/rest/services/MDOT/MdotFiveYearPlanOpenData/FeatureServer/45,"-90.4772,41.6606,-82.097,47.2172",http://gis-michigan.opendata.arcgis.com/datasets/7b041cb6663444d28cb69c422c86c9c1_45
State of Michigan,"[u'Natural', u'Rivers', u'DNR', u'Michigan']",http://gis-michigan.opendata.arcgis.com/datasets/076298de35ba420a8330df08492f018b_12,Natural Rivers Polygons,Natural Rivers Polygons,2018-10-30T17:59:02.000Z,2018-10-30T15:19:59.265Z,http://gis-michigan.opendata.arcgis.com/datasets/076298de35ba420a8330df08492f018b_12,https://services3.arcgis.com/Jdnp1TjADvSDxMAX/arcgis/rest/services/dnrFisheries/FeatureServer/12,"-90.0624,41.632,-82.0756,48.1483",http://gis-michigan.opendata.arcgis.com/datasets/076298de35ba420a8330df08492f018b_12
State of Michigan,"[u'Natural', u'Rivers', u'DNR', u'Michigan']",http://gis-michigan.opendata.arcgis.com/datasets/1a3a781aae8648c8a5f927f468b371f9_11,Natural Rivers,Michigan Natural Rivers,2018-10-30T17:48:56.000Z,2018-10-30T18:04:42.840Z,http://gis-michigan.opendata.arcgis.com/datasets/1a3a781aae8648c8a5f927f468b371f9_11,https://services3.arcgis.com/Jdnp1TjADvSDxMAX/arcgis/rest/services/dnrFisheries/FeatureServer/11,"-90.0624,41.632,-82.0756,48.1483",http://gis-michigan.opendata.arcgis.com/datasets/1a3a781aae8648c8a5f927f468b371f9_11
State of Michigan,"[u'dnr', u'fish', u'creel', u'Fishing']",http://gis-michigan.opendata.arcgis.com/datasets/84626254386246518a43a7a6f1ea2049_16,Michigan Creel Data Harvest,This data is an estimate of the total harvest (number of fish removed) and catch (number of fish harvested and number of fish caught),2016-03-01T14:55:29.000Z,2018-10-30T17:43:56.491Z,http://gis-michigan.opendata.arcgis.com/datasets/84626254386246518a43a7a6f1ea2049_16,https://services3.arcgis.com/Jdnp1TjADvSDxMAX/ArcGIS/rest/services/dnrFisheries/FeatureServer/16,"-180.0,-90.0,180.0,90.0",http://gis-michigan.opendata.arcgis.com/datasets/84626254386246518a43a7a6f1ea2049_16
State of Michigan,[u'transportation'],http://gis-michigan.opendata.arcgis.com/datasets/feb283feaead4b6284f6a06ebba2a4ca_0,Detroit People Mover Stations,Detroit People Mover Stations layer.,2018-10-02T15:44:23.000Z,2018-10-02T15:44:46.651Z,http://gis-michigan.opendata.arcgis.com/datasets/feb283feaead4b6284f6a06ebba2a4ca_0,https://services1.arcgis.com/xUx8EjNc6egUPYWh/arcgis/rest/services/Detroit_People_Mover_Stations/FeatureServer/0,"-83.05267482645229,42.3252406742519,-83.03998705461706,42.33580436753613",http://gis-michigan.opendata.arcgis.com/datasets/feb283feaead4b6284f6a06ebba2a4ca_0
State of Michigan,"[u'Roads', u'    DNR', u'    NLP', u'    PA288']",http://gis-michigan.opendata.arcgis.com/datasets/e892444688ae467e8013e227a565c155_0,DNR ROADS NLP,DNR Road and ORV Status,2018-10-31T15:28:50.000Z,2018-10-31T18:01:23.542Z,http://gis-michigan.opendata.arcgis.com/datasets/e892444688ae467e8013e227a565c155_0,https://services3.arcgis.com/Jdnp1TjADvSDxMAX/arcgis/rest/services/DNR_ROADS_NLP/FeatureServer/0,"-89.97969962161392,41.66808376639093,-82.20040397977928,47.42374718628782",http://gis-michigan.opendata.arcgis.com/datasets/e892444688ae467e8013e227a565c155_0
State of Michigan,[u'Transportation'],http://gis-michigan.opendata.arcgis.com/datasets/11941f347a5d40d39dcb4f7db57a6ead_0,Detroit People Mover Route,Detroit People Mover Route originally obtained from the Detroit Data Collaborative.,2018-10-02T15:42:57.000Z,2018-10-10T19:20:41.253Z,http://gis-michigan.opendata.arcgis.com/datasets/11941f347a5d40d39dcb4f7db57a6ead_0,https://services1.arcgis.com/xUx8EjNc6egUPYWh/arcgis/rest/services/Detroit_People_Mover_Route/FeatureServer/0,"-83.05279950183396,42.32456355143988,-83.03949452182151,42.33631714087456",http://gis-michigan.opendata.arcgis.com/datasets/11941f347a5d40d39dcb4f7db57a6ead_0
State of Michigan,"[u'dnr', u'fish', u'creel', u'Fishing']",http://gis-michigan.opendata.arcgis.com/datasets/1e71a854afea41c4ad1aa95b20393d6c_15,Michigan Creel Data Effort,This data is an estimate of the total effort (hours fished) by anglers.,2016-03-01T14:54:44.000Z,2018-10-30T17:44:32.062Z,http://gis-michigan.opendata.arcgis.com/datasets/1e71a854afea41c4ad1aa95b20393d6c_15,https://services3.arcgis.com/Jdnp1TjADvSDxMAX/ArcGIS/rest/services/dnrFisheries/FeatureServer/15,"-180.0,-90.0,180.0,90.0",http://gis-michigan.opendata.arcgis.com/datasets/1e71a854afea41c4ad1aa95b20393d6c_15
